{
  "id": "project.bilibili-column.old-editor-return-button",
  "type": "repo_fact",
  "scope": "repo",
  "repo_id": "bilibili/column-web",
  "repo_id": "bilibili/column-web",
  "title": "Old Editor Return Button",
  "status": "active",
  "visibility": "team",
  "confidence": 0.91,
  "ttl_days": 180,
  "expires_at": "2026-12-09T00:00:00+08:00",
  "revision": 3,
  "content_hash": "sha256:abc123def456",
  "source_git_commit": "abc123",
  "source_refs": ["session.20260612.xxx"],
  "tags": ["web", "editor"],
  "applies_to": {
    "repo_patterns": ["bilibili/column-*"],
    "package_names": ["@bilibili/column-web"],
    "path_patterns": ["packages/editor/**"]
  },
  "created_at": "2026-06-12T10:00:00+08:00",
  "updated_at": "2026-06-12T10:00:00+08:00"
}
